[
  {
    "id": "hyp:surveillance:columbus",
    "origin": "hypothesis",
    "question": "Open thread — H3 Consumer Surveillance @ columbus",
    "detail": "No documented nexus yet for columbus under H3 Consumer Surveillance. Fields: operator=—, capital=Enterprise-zone abatement (signal).",
    "source": "data/hypotheses/surveillance/columbus.yaml",
    "kind": null,
    "status": null,
    "issue": null,
    "hypothesis": "surveillance",
    "hypothesis_label": "H3 Consumer Surveillance",
    "signal": "watch"
  }
]
